{
  "schema_version": "1.0.0",
  "cve_id": "CVE-2025-0938",
  "source_feeds": ["nvd"],
  "severity": { "rating": "medium", "cvss_v3_score": 6.3 },
  "published_at": "2025-01-28T00:00:00Z",
  "summary": "Host-parsing confusion (CWE-20 improper input validation) in CPython's urllib.parse. _urlsplit() validated a bracketed host by extracting only the text between '[' and ']' (netloc.partition('[')[2].partition(']')[0]) and ignoring any data BEFORE the '[' or AFTER the ']'. A netloc such as 'example.com[::1]' therefore passed validation (the inner '::1' is a valid IPv6) even though 'example.com' precedes the bracket, yielding a parsed result that disagrees with how other components read the host -- a parser-differential that can be leveraged for SSRF / origin confusion (gh-issue-105704). Fixed upstream (CPython) by adding _check_bracketed_netloc(), which rejects any data before '[' or after ']' other than a ':port'. nixpkgs ships an affected python3 (3.11.x).",
  "affected": [
    { "attr_path": "python3", "drv_path": "/nix/store/00000000000000000000000000000938-python3-3.11.drv", "pname": "python3", "version": "3.11", "confidence": "high" }
  ],
  "mapping": { "cpe": ["cpe:2.3:a:python:cpython:*:*:*:*:*:*:*:*"], "method": "cpe-exact" },
  "replay_critical": true
}
