{
  "affected": [
    {
      "attr_path": "snipe-it",
      "confidence": "medium",
      "confidence_reason": "pname heuristic match (no CPE/PURL hit)",
      "drv_path": "/nix/store/00000000000000000000000000000000-snipe-it.drv",
      "pname": "snipe-it",
      "version": "8.4.1"
    }
  ],
  "cve_id": "CVE-2026-84206",
  "mapping": {
    "mapping_notes": "pname heuristic match (no CPE/PURL hit)",
    "method": "pname-heuristic"
  },
  "published_at": "2026-09-01T15:19:00.229Z",
  "references": [
    {
      "kind": "advisory",
      "url": "https://cve.vulnpatch.dev/CVE-2026-84206"
    },
    {
      "kind": "other",
      "url": "https://api.vulnpatch.dev/api/v1/cve/CVE-2026-84206"
    },
    {
      "kind": "advisory",
      "url": "https://www.cve.org/CVERecord?id=CVE-2026-84206"
    },
    {
      "kind": "other",
      "url": "https://osv.dev/vulnerability/CVE-2026-84206"
    },
    {
      "kind": "advisory",
      "url": "https://nvd.nist.gov/vuln/detail/CVE-2026-84206"
    },
    {
      "kind": "other",
      "url": "https://www.first.org/epss/"
    },
    {
      "kind": "other",
      "url": "https://github.com/grokability/snipe-it"
    },
    {
      "kind": "other",
      "url": "https://github.com/grokability/snipe-it/blob/v8.6.3/app/Http/Controllers/Assets/BulkAssetsController.php"
    },
    {
      "kind": "other",
      "url": "https://github.com/grokability/snipe-it/commit/686329001aa457f716b269600659839a58895fee"
    },
    {
      "kind": "other",
      "url": "https://github.com/grokability/snipe-it/releases/tag/v8.7.0"
    },
    {
      "kind": "other",
      "url": "https://github.com/grokability/snipe-it/security/advisories/GHSA-m863-2j99-jxwm"
    },
    {
      "kind": "other",
      "url": "https://www.vulncheck.com/advisories/snipe-it-before-8.7.0-authorization-bypass-via-bulk-restore"
    },
    {
      "kind": "other",
      "url": "https://github.com/grokability/snipe-it/security/advisories/GHSA-m863-2j99-jxwm"
    }
  ],
  "replay_critical": true,
  "schema_version": "1.0.0",
  "severity": {
    "cvss_v3_score": 4.3,
    "rating": "medium"
  },
  "source_feeds": [
    "nvd"
  ],
  "summary": "Snipe-IT before 8.7.0 gates the bulk asset restore endpoint on the assets.edit permission instead of assets.delete, allowing users without delete rights to restore soft-deleted assets. Attackers with edit permissions can post asset identifiers to the bulk restore endpoint to undo administrator deletions and bypass intended permission separation."
}
