{
  "schema_version": "1.0.0",
  "cve_id": "CVE-2025-9640",
  "source_feeds": ["nvd", "osv"],
  "severity": {
    "rating": "medium",
    "cvss_v3_score": 4.3
  },
  "published_at": "2025-10-15T00:00:00Z",
  "summary": "A flaw was found in Samba, in the vfs_streams_xattr module, where uninitialized heap memory could be written into alternate data streams. This allows an authenticated user to read residual memory content that may include sensitive data, resulting in an information disclosure vulnerability (CWE-908). The flaw is in streams_xattr_pwrite(), which fails to initialize memory before writing file gaps. Fixed in Samba 4.22.5 (also 4.21.9, 4.23.2). Systems not using the vfs_streams_xattr module are unaffected. Co-fixed with CVE-2025-10230.",
  "affected": [
    {
      "attr_path": "samba",
      "drv_path": "/nix/store/00000000000000000000000000009640-samba-4.22.3.drv",
      "pname": "samba",
      "version": "4.22.3",
      "confidence": "high"
    }
  ],
  "mapping": {
    "cpe": ["cpe:2.3:a:samba:samba:4.22.3:*:*:*:*:*:*:*"],
    "method": "cpe-exact"
  },
  "replay_critical": true
}
