{
  "schema_version": "1.0.0",
  "cve_id": "CVE-0000-9007",
  "source_feeds": ["nvd"],
  "severity": { "rating": "high", "cvss_v3_score": 7.5 },
  "published_at": "2026-04-15T00:00:00Z",
  "affected": [
    {
      "attr_path": "libexample",
      "drv_path": "/nix/store/11111111111111111111111111111111-libexample-1.4.7.drv",
      "pname": "libexample",
      "version": "1.4.7",
      "confidence": "high"
    }
  ],
  "mapping": { "cpe": ["cpe:2.3:a:example:libexample:1.4.7:*:*:*:*:*:*:*"], "method": "cpe-exact" },
  "replay_critical": true
}
