{
  "schema_version": "1.0.0",
  "cve_id": "CVE-2026-16599",
  "source_feeds": [
    "nvd"
  ],
  "severity": {
    "rating": "medium",
    "cvss_v3_score": 5.9
  },
  "published_at": "2026-08-25T00:00:00Z",
  "summary": "Uncontrolled resource consumption (CWE-770) in GNU wget 1.25.0 and earlier. In `ftp_login()` in `src/ftp-basic.c`, the FTP OPIE/S-KEY challenge line supplies a sequence number that wget parses without an upper bound and then uses as the iteration count of an MD5 key-derivation loop. A malicious or intercepted FTP server can answer with a sequence near INT_MAX, forcing wget to perform roughly 2.1 billion MD5 computations and stall. The --timeout option does not help: it bounds network I/O, not CPU work. Fixed upstream by refusing the login once the parsed sequence exceeds 9999.",
  "affected": [
    {
      "attr_path": "wget",
      "version": "1.25.0",
      "pname": "wget",
      "drv_path": "/nix/store/00000000000000000000000000016599-wget-1.25.0.drv",
      "confidence": "high",
      "src_url": "mirror://gnu/wget/wget-1.25.0.tar.lz"
    }
  ],
  "replay_critical": true,
  "mapping": {
    "method": "pname-heuristic",
    "cpe": [
      "cpe:2.3:a:gnu:wget:1.25.0:*:*:*:*:*:*:*"
    ],
    "mapping_notes": "CVE record carries no CPE configuration; matched on pname wget against the pinned nixpkgs attr, confirmed by the fix commit touching src/ftp-basic.c in gnuwget/wget."
  }
}
