{
  "schema_version": "1.0.0",
  "cve_id": "CVE-2026-4539",
  "source_feeds": [
    "nvd"
  ],
  "severity": {
    "rating": "medium",
    "cvss_v3_score": 5.5
  },
  "published_at": "2026-03-25T00:00:00Z",
  "summary": "ReDoS (Regular Expression Denial of Service, CWE-1333) in Pygments' Archetype Definition Language (ADL) lexer. Two regex patterns in pygments/lexers/archetype.py lacked quantifier upper bounds: (1) AtomsLexer 'archetype_id' rule used bare \\w+ inside nested alternation, enabling 2^N backtracking on crafted long identifiers; (2) AdlLexer 'GUID' rule used (\\d|[a-fA-F])+(-( \\d|[a-fA-F])+){3,}, an alternation-in-repetition pattern causing 2^N backtracking when the last segment contains a non-hex terminator. An attacker who controls input tokenized by the Pygments archetype lexer can cause indefinite CPU consumption. Fixed upstream in pygments/pygments commit 2be805d86471efb8efd51886d4d11a33fa22a928 by adding {1,100} bounds to \\w+ and replacing the GUID alternation with [0-9a-fA-F]{1,36}(-[0-9a-fA-F]{1,36}){3,}.",
  "affected": [
    {
      "attr_path": "python3Packages.pygments",
      "drv_path": "/nix/store/00000000000000000000000000004539-python3.13-pygments-2.19.2.drv",
      "pname": "pygments",
      "version": "2.19.2",
      "confidence": "high"
    }
  ],
  "mapping": {
    "cpe": [
      "cpe:2.3:a:pygments:pygments:2.19.2:*:*:*:*:*:*:*"
    ],
    "method": "cpe-exact"
  },
  "replay_critical": true
}
