{
  "schema_version": "1.0.0",
  "cve_id": "CVE-2025-59681",
  "source_feeds": ["nvd", "osv"],
  "severity": {
    "rating": "high",
    "cvss_v3_score": 8.7
  },
  "published_at": "2025-10-01T00:00:00Z",
  "summary": "SQL injection (CWE-89) in Django QuerySet.annotate(), alias(), aggregate(), and extra() when called with a dictionary expansion (`**kwargs`) whose keys are attacker-controlled column-alias names, on the MySQL and MariaDB backends. The vulnerable code path is the MySQL backend's identifier-quoting in `django.db.backends.mysql.operations.DatabaseOperations.quote_name` interacting with the QuerySet compiler's alias-substitution. SQLite, PostgreSQL, and Oracle backends quote identifiers differently and are not affected. Fixed upstream in commit 41b43c74bd (main) / 38d9ef8c7b (4.2.x backport) shipped in Django 4.2.25, 5.1.13, and 5.2.7 (1 Oct 2025). Co-fixed with CVE-2025-59682 in the same security-release set.",
  "affected": [
    {
      "attr_path": "python3Packages.django_4",
      "drv_path": "/nix/store/00000000000000000000000000000089-python3.13-django-4.2.24.drv",
      "pname": "django",
      "version": "4.2.24",
      "confidence": "high"
    }
  ],
  "mapping": {
    "cpe": [
      "cpe:2.3:a:djangoproject:django:4.2.24:*:*:*:*:*:*:*"
    ],
    "method": "cpe-exact"
  },
  "replay_critical": true
}
