{
  "schema_version": "1.0.0",
  "cve_id": "CVE-2023-40890",
  "source_feeds": [
    "nvd"
  ],
  "severity": {
    "rating": "high",
    "cvss_v3_score": 7.8
  },
  "published_at": "2023-11-17T00:00:00Z",
  "summary": "Stack overflow and out-of-bounds read in zbar 0.23.92. CVE-2023-40889: qrcode/qrdec.c qr_reader_match_centers() had missing bounds checks for loop indices i and j before testing mark[i]/mark[j]; a crafted QR code triggers out-of-bounds reads. CVE-2023-40890: databar.c lookup_sequence() had an unbounded loop counter 'i' that could exceed the seq[] array bounds; the fix adds a bounds check (exit with diagnostic if i>20). Both fixed by simple bounds-check patches. Source-backport against nixpkgs zbar 0.23.92 at nixpkgs commit de6c085635fb4c013d9a3a9f34b643302735dc70.",
  "affected": [
    {
      "attr_path": "zbar",
      "drv_path": "/nix/store/00000000000000000000000000000000-zbar-0.23.92.drv",
      "pname": "zbar",
      "version": "0.23.92",
      "confidence": "high"
    }
  ],
  "mapping": {
    "cpe": [
      "cpe:2.3:a:zbar_project:zbar:0.23.92:*:*:*:*:*:*:*"
    ],
    "method": "cpe-exact"
  },
  "replay_critical": true
}
