{
  "affected": [
    {
      "attr_path": "netron",
      "confidence": "medium",
      "confidence_reason": "pname heuristic match (no CPE/PURL hit)",
      "drv_path": "/nix/store/00000000000000000000000000000000-netron.drv",
      "pname": "netron",
      "version": "9.0.9"
    }
  ],
  "cve_id": "CVE-2026-79718",
  "mapping": {
    "mapping_notes": "pname heuristic match (no CPE/PURL hit)",
    "method": "pname-heuristic"
  },
  "published_at": "2026-08-27T16:37:25.817Z",
  "references": [
    {
      "kind": "advisory",
      "url": "https://cve.vulnpatch.dev/CVE-2026-79718"
    },
    {
      "kind": "other",
      "url": "https://api.vulnpatch.dev/api/v1/cve/CVE-2026-79718"
    },
    {
      "kind": "advisory",
      "url": "https://www.cve.org/CVERecord?id=CVE-2026-79718"
    },
    {
      "kind": "advisory",
      "url": "https://github.com/advisories?query=CVE-2026-79718"
    },
    {
      "kind": "other",
      "url": "https://osv.dev/vulnerability/CVE-2026-79718"
    },
    {
      "kind": "advisory",
      "url": "https://nvd.nist.gov/vuln/detail/CVE-2026-79718"
    },
    {
      "kind": "other",
      "url": "https://www.first.org/epss/"
    },
    {
      "kind": "other",
      "url": "https://github.com/lutzroeder/netron/commit/cd14bad8c9132b1aaf1d197fe61925575f194f00"
    },
    {
      "kind": "other",
      "url": "https://www.hiddenlayer.com/sai-security-advisory/2026-08-netron"
    },
    {
      "kind": "other",
      "url": "https://www.hiddenlayer.com/sai-security-advisory/2026-08-netron"
    }
  ],
  "replay_critical": true,
  "schema_version": "1.0.0",
  "severity": {
    "cvss_v3_score": 6.8,
    "rating": "unknown"
  },
  "source_feeds": [
    "nvd"
  ],
  "summary": "Reflected XSS in Netron versions <=9.1.2 on desktop application through unsanitized node names allows an attacker to hide certain nodes, perform port scanning or abuse a Chrome n-day to achieve Remote Code Execution."
}
