{
  "schema_version": "1.0.0",
  "cve_id": "CVE-2026-21722",
  "source_feeds": ["nvd", "osv"],
  "severity": {
    "rating": "medium",
    "cvss_v3_score": 5.3
  },
  "published_at": "2026-02-12T00:00:00Z",
  "summary": "Public dashboards with annotations enabled did not limit their annotation timerange to the locked timerange of the public dashboard. An unauthenticated user can read the entire history of annotations visible on the specific dashboard, even those outside the locked timerange, when the public dashboard has both annotations enabled and time selection locked. Fixed in Grafana 12.3.3 (also 11.6.10+security-01, 12.1.6+security-01, 12.2.4+security-01). The fix uses the dashboard's configured timerange when time selection is disabled on the public dashboard.",
  "affected": [
    {
      "attr_path": "grafana",
      "drv_path": "/nix/store/00000000000000000000000021722000-grafana-12.3.2.drv",
      "pname": "grafana",
      "version": "12.3.2",
      "confidence": "high"
    }
  ],
  "mapping": {
    "cpe": ["cpe:2.3:a:grafana:grafana:12.3.2:*:*:*:*:*:*:*"],
    "method": "cpe-exact"
  },
  "replay_critical": true
}
