{
  "schema_version": "1.0.0",
  "cve_id": "CVE-2023-28484",
  "source_feeds": ["nvd"],
  "severity": { "rating": "medium", "cvss_v3_score": 6.5 },
  "published_at": "2023-04-24T00:00:00Z",
  "summary": "NULL pointer dereference (CWE-476) in libxml2 2.10.3 reachable through XML Schema (XSD) compilation. When xmlSchemaFixupComplexType() processes a complex type that derives by complexContent extension from a base type whose own content model is absent (a base declared with simpleContent carries no element content model), the fixup code that splices the base type's content model into the derived type reads the base type's content-model pointer without first checking that it is present. That pointer is NULL for a simpleContent base, so a crafted invalid schema in which a complexContent extension names a simpleContent base crashes the schema compiler with a NULL read while xmllint --schema (or any application that compiles the schema) processes it. Affects the libxml2 2.10.3 package.",
  "affected": [
    { "attr_path": "libxml2", "drv_path": "/nix/store/00000000000000000000000000028484-libxml2-2.10.3.drv", "pname": "libxml2", "version": "2.10.3", "confidence": "high" }
  ],
  "mapping": { "cpe": ["cpe:2.3:a:xmlsoft:libxml2:2.10.3:*:*:*:*:*:*:*"], "method": "cpe-exact" },
  "replay_critical": true
}
